show_id,type,title,director,cast,country,date_added,release_year,rating,duration,listed_in,description
81145628,Movie,Norm of the North: King Sized Adventure,"Richard Finn, Tim Maltby","Alan Marriott, Andrew Toth, Brian Dobson","United States, India, South Korea, China",9-Sep-19,2019,TV-PG,90 min,"Children & Family Movies, Comedies","Before planning an awesome wedding for his grandfather, a polar bear king must take back a stolen artifact from an evil archaeologist first."
80117401,Movie,Jandino: Whatever it Takes,,Jandino Asporaat,United Kingdom,9-Sep-16,2016,TV-MA,94 min,Stand-Up Comedy,"Jandino Asporaat riffs on the challenges of raising kids and serenades the audience with a rousing rendition of ""Sex on Fire"" in his comedy show."
70234439,TV Show,Transformers Prime,,"Peter Cullen,  Sumalee Montano, Frank Welker, Jeffrey Combs",United States,8-Sep-18,2013,TV-Y7-FV,1 Season,Kids' TV,"With the help of three human allies, the Autobots once again protect Earth from the onslaught of the Decepticons and their leader, Megatron."
70304989,Movie,Automata,"Gabe Ibáñez, Khomsun",,"Bulgaria, United States, Spain, Canada",8-Sep-17,2014,R,110 min,"International Movies, Sci-Fi & Fantasy, Thrillers","In a dystopian future, an insurance adjuster for a tech company investigates a robot killed for violating protocol and discovers a global conspiracy."
80164077,Movie,Fabrizio Copano: Solo pienso en mi,"Rodrigo Toro, Francisco Schultz",Fabrizio Copano,Chile,8-Sep-17,2017,TV-MA,60 min,Stand-Up Comedy,"Fabrizio Copano takes audience participation to the next level in this stand-up set while reflecting on sperm banks, family WhatsApp groups and more."
80117902,TV Show,Fire Chasers,,Khomsun,United States,8-Sep-17,2017,TV-MA,1 Season,"Docuseries, Science & Nature TV","As California's 2016 fire season rages, brave backcountry firefighters race to put out the flames, protect homes and save lives in this docuseries."
